Good Sense Clearlax, Polyethylene Glycol, Osmotic Laxative 3350 Powder for Solution, 8.3 Ounce
Garden of Life Super Seed Beyond Fiber, 600 Grams
Gain with FreshLock with Bleach Outdoor Sunshine Powder Detergent 63 Loads, 100-Ounce
Strutz Sole Angel Moisturizing Socks, 4 Ounce
Trusted Nutrients Garcinia Cambogia Extract 100% Pure, 1000mg Per Veggie Cap, 65% HCA, 180 Count, Serving Size Just 1 Veggie Cap
Charmin Freshmates Flushable Wipes 40 Count Refills; Pack of 12; 480 total Count
Veet Gel Hair Remover Cream, Sensitive Formula, 13.50 Ounce (Packaging may vary)
Gillette Mach3 Sensitive Power Razor 1 Count
Nuun Active Hydration, Electrolyte Enhanced Drink Tablets, Original Mixed Flavor 4-pack: Lemon+Lime, Tri-Berry, Orange, Citrus Fruit (4 Tubes/12 Tabs Per Tube)
Panasonic ER-GN30-K Nose, Ear &amp; Facial Hair Trimmer Wet/Dry with Vortex Cleaning System
Life Extension Vitamin D3, 5000 IU, 60 Softgels
Voots Veggie Fruit Tarts, 14 Count
Bounty Huge Roll, White, 6 Count
Remington MB4040 Lithium Ion Powered Men's Rechargeable Mustache Beard and Stubble Trimmer
Doctor's Best High Absorption CoQ10 (100 mg), Softgels 60-Count
Top Rated Yacon Syrup - 100% Money Back Guarantee - All Natural Pure Premium Raw Yacon Root Extract From Peru - Quality Sugar Substitute Super Food Seen On Dr. OZ - Great For Diets, Weight Loss &amp; Lean Living, 8oz, 48 Servings By BRI Nutrition
Seventh Generation Liquid Laundry 4x, Baby, 40 Ounce Bottle, 2 Count
Merkur Super Double Edge Razor Blades - Pack of 10 Blades - Made in Germany
Always Radiant Incredibly Thin Liners Unscented 128 Count
maXreduce - Extreme Fat Burner Guaranteed Weight Loss
Suave Clinical Protection Powder Fresh 24 Hour Prosolid Anti-perspirant/Deodorant, 1.7-Ounce Boxes (Pack of 4)
Bach Flower Essences Rescue Remedy Spray
Jarrow Formulas CDP Choline 250mg, 60 Capsules
Jarrow Formulas Conjugated Linoleic Acid (CLA), 750mg, 90 Softgels
Combo 50 (LH) Ovulation &amp; 20 (HCG) Pregnancy Test Strips (1)
Nexcare Waterproof Clear Bandage Assorted Sizes, 50-Count Packages (Pack of 4)
Jarrow Formulas Quercetin 500mg, 200 Capsules
Always Radiant Infinity Regular With Wings Scented Pads 16 Count
Garden of Life Raw Organic Protein, 622 Grams
Dragon Herbs Heaven Mountain Goji Berries -- 8 oz
Crest Pro-Health For Life CPC Antigingivitis/Antiplaque Smooth Mint Rinse 16.9 Fl Oz
Woolite Everyday Laundry Detergent, 50 Ounce
Clio Designs Palmperfect Electric Shaver in Patterns, Color and Pattern may vary
Remington F5790 Pivot &amp; Flex Men's Rechargeable Cord/Cordless Foil Shaver with LED Power Guage
Jarrow Formulas Acetyl L-Carnitine 500mg, 60 Capsules
Panasonic ES-SL41-W 3 Blade Men's Electric Razor Wet/Dry with Pop-up Trimmer, White
Remington FR-750 Pivot and Flex Men's Rechargeable Shaver with Three Flexing Foils and Intercept Trimmer, Black
Kal Nutritional Yeast Flakes -- 22 oz
Seventh Generation Fabric Softener Sheets, Free &amp; Clear, 65-Count Boxes (Pack of 3)
Organic Fenugreek GOLD - 750 mg, 120 Vegetarian Capsules (GMO-free, Preservative-free, Allergen-free Organic Fenugreek Seed Powder in Veg. Capsules for Breastfeeding)
Body Fortress Super Advanced Whey Protein, Cookies 'N Cream, 1.95 Pounds
Micro Touch Max Hair Remover- colors may vary
Bio-Synergy Whey Better, Stawberry, 750 Grams
Crest 3d White Vivid Teeth Whitening Strips 10 Count
DEVA Vegan Vitamins Vegan DHA (Algae) 200mg Vegan Softgels, 90-Count Bottle
Braun 7681 Silk-Epil 7 Xpressive Pro Epilator
Seventh Generation Auto Dish Tabs, Lemon, 15-Count Packages (Pack of 12)
Speed Stick Gear Gel Deodorant, Fresh Force, 3 Ounce
Phytoceramides By Vita Vibrance &#9733;&#9733; RATED 5 OUT OF 5 STARS &#9733;&#9733; Highest Rated Phytoceramides By Amazon Verified Purchasers - Strengthens Collagen - Anti-Aging - Gluten Free - Plant Derived - Vegan - Rice - No Sweet Potato Fillers - All Natural Facelift - Skin Hydration - Added Vitamin A, C, D, &amp; E - Maintain A More Youthful Appearance - Healthy Skin - Dr Oz - Capsules - Pills - Supplements - For Skin - Premium Facial Rejuvenation - All Natural - Skin Smoothness - Reduce Wrinkles - Reduce Crows Feet - No Lipo Wheat - Limited Time 50% OFF Promotion - On Sale - 100% Guaranteed - GMP Certified - Made in USA
Fungi Nail 1oz Solution
Cotz Sensitive SPF 40 Sunscreen (3.5oz)
Lifetime Life's Basics Plant Protein with Greens,  19.84-Ounces Tub
Philips HP6378 Bikini Perfect Deluxe Trimmer, Opal / Aqua
PhysiciansCare Office First Aid Kit For 25 People, Contains 131 Pieces
100% PURE GARCINIA CAMBOGIA EXTRACT 80% HCA SUPER STRENGTH APPETITE SUPPRESSANT AND FAT BLOCKER MADE IN USA
Stoner 92164 Invisible Glass for Window, Windshield and Mirror Cleaner - 22 oz.
Nature's Bounty Probiotic Acidophilus Tablet Twin Pack, 100 Count Bottles, 200 Count Total(Packaging May Vary)
Gaia Herbs SleepThru, 60 Liquid Phyto-Capsules
K-Y Intense Arousal Gel For Her, 0.34  Ounce
Zarbee's Naturals Adult Daytime Drink, Apple Spice, 6 Count
Supersmile Whitening System, Original Mint,Set ,1.2 &amp; 1.4 Ounce
Howard BBC012 Butcher Block Conditioner, 12-Ounce
Burt's Bees Coconut Foot Cr&egrave;me, 4.34  Oz.
Purest Garcinia Cambogia Extract, Highest Grade &amp; Quality HCA (Best Formula) &#9733; Pure &amp; Potent with Extra Strength &#9733; Safe &amp; Effective Weight Loss Supplement &#9733; 90 Caps &amp; Guaranteed By Natures Design
Kirkland Signature Daily Multi Vitamins &amp; Minerals Tablets, 500-Count Bottle
Tide Original Scent Liquid Laundry Detergent ,  50 Fl Oz,  2 Count
(540 Needles) TMT Micro Needle Roller System Titanium 1.5 mm for Wrinkles, Scar, Acne, Cellulite Treatment (More effective than regular 192 needle derma rollers)
Philips HF3510 Wake-Up Light, White
Jarrow Formulas Red Yeast Rice + CoQ10, 650 mg, 120 Count
Motorola P1002 Dect_6.0 1-Handset 2-Line Landline Telephone
Method Smarty Dish Detergent 20ct, Pink Grapefruit (Pack of 6)
Chattanooga Polyurethane Half Size Cold Pack, 6.5 x 11-Inch, Black
NOW Foods Almond Oil, 4 Ounce
EatSmart Precision GetFit Digital Body Fat Scale w/ 400 lb. Capacity &amp; Auto Recognition Technology
Plackers Mouth Guard Grind No More Night Time Use - 1 package (10 count)
Tranquil Synergy Essential Oil Blend. 10 ml. 100% Pure, Undiluted, Therapeutic Grade. (Blend of: Bergamot, Patchouli, Blood Orange, Ylang Ylang and Grapefruit)
Jarrow Formulas Vinpocetine, 100 Capsules
Good Sense Ibuprofen Caplets, 200 mg, 24-Count
Seventh Generation Fabric Softener Sheets, Blue Eucalyptus &amp; Lavender, 65-Count Boxes (Pack of 3)
Sundown Naturals Whole Food Multi Tablet for Men, 90 Count
Nature's Way Ginger Root, 550 mg, 100  Capsules
Gillette Fusion ProGlide Power Razor
OXO Good Grips Electronics Cleaning Brush
Playtex Sport Playtex Sport Body Wipes Travel Pack, 24 Count, Pack of 5
Source Naturals Optizinc Zinc Monomethionine 30mg, 120 Tablets
Diet Pills, Slimula Lose up to 20 Pounds in Just 4 Weeks!!! 60 Dietary Supplement, Slimming Capsules.
Always Infinity, 32-count Boxes (Pack of 6)
AmazonBasics AA Alkaline Batteries (20-Pack)
Men's Sof Sole Comfort Shock Absorption Airr Insoles
Panasonic ES2216PC Close Curves Wet/Dry Shaver for Ladies with Bikini Attachment
Doctor's Best High Absorption Magnesium (200 Mg Elemental), 240-Count
Philips Sonicare HX6311/02 Sonicare for Kids Rechargeable Electric Toothbrush
Depend Underwear for Women, Maximum, Small/Medium, Case/72 (4/18s)
Jarrow Formulas Pterostilbene, 50 Mg, 60 Vegetarian Capsules
Charmin Freshmates Flushable Wipes 40 Count Refills; Pack of 12; 480 total Count
CETIRIZINE 10 MG TAB 100 [Health and Beauty]
Garden of Life Kind Organics Organic B-12 Spray, 2 Ounce
Neosporin + Pain Relief , Maximum Strength, 1 Ounce
AmazonBasics AA Ni-MH Pre-Charged Rechargeable Batteries (4-Pack) - 1000 Cycle (Typical 2000mAh, Minimum 1900mAh)
Degree Clinical Protection, Women's Anti-perspirant and Deodorant, Shower Clean, 1.7-Ounce Stick (Pack of 2)
Nexcare 524928 Rapid Flex Digital Thermometer
Optimum Nutrition 100% Whey Gold Standard, Chocolate Mint, Net WT. 5 LB
Febreze Sleep Serenity Bedroom Mist, Air Effect, Warm Milk and Honey, 9.7 Ounce (Pack of 9)
Crest 3d White 1-Hour Express Teeth Whitening Strips 4 Count
New Chapter Every Man's One Daily 40+ Multivitamin, 24 Tablets
XyliMelts for Dry Mouth, Mint-Free, 80-Count Boxes
Raspberry Ketones Miracle Fat Burner and 100 % Purest Professional Formula for Natural Weight Loss, 120 Count
Now Foods Magnesium Citrate 200mg,  250 Tablets
Conair My Aromatherapy with Oil (Colors May Vary)
Philips Norelco AT790/40 Caretouch Electic Razor with Aquatec
NutriGold Pure Green Coffee Bean Extract, 90 Vegetarian Capsules
Woolite Darks Laundry Detergent, 50 Ounce
#1 Recommended Best Probiotic Supplement: 60 Once Daily Time Release Pearls - 15x More Effective than Capsules with Patented Delivery Technology - Easy to Swallow - Lactose and Gluten Free - Great Probiotics Supplement for Women, Men &amp; Children - Improve Your Digestive System and Intestinal Health with 15 Best Strains: Lactobacillus, Streptococcus and Bifidobacterium | Hyperbiotics PRO-15
Clubman Pinaud After Shave Lotion, 6 Ounce
Colgate Optic White Whiteseal Mouthwash, Icy Fresh Mint, 8 Fluid Ounce (Pack of 6)
Tide Stain Release Duo Pac In-Wash Booster Twin Pack, 18-count Bag
Conair Foot Spa with Bubbles &amp; Heat
Eklund Essential Omega - Norwegian Fish Oil - 90 Capsules - Pharmaceutical Grade Fish Oil in Superior Triglyceride Form - Natural Lemon Flavor and 100% Money Back Guarantee
Crest 3d White Vivid Teeth Whitening Strips 10 Count
Nexcare Sensitive Skin Tape,  1&quot; X 4 yd,  6 Count
Fiber Choice Fruity Bites Nutritional-Supplements, Assorted Flavors, 90 Count
Caltrate 600+D Plus Chewables, 155-Count
Lysol Cling Gel Toilet Bowl Cleaner, Ocean Scent, 24 Ounce (Pack of 4)
Nelson Bach - Rescue Pastilles Black Currant, 1.7 oz
Solgar Biotin Vegetable Capsules, 5000 mcg, 50 Count
Good Sense One Daily Men's Health Formula Multivitamin/Multimineral Supplement, 100 Count
Jarrow Formulas Milk Thistle, 150 mg, 100 Count
Bounty Paper Towels 6 Huge Rolls
Panasonic WES035P Replacement Vortex HydraClean Solution Cartridges for Men's Shaver Systems
Philips Sonicare HX6013 Proresults Brush Head, Standard, 3 Pack
Dixie Ultra Disposable Plates, 8 1/2 Inch, 384 Count
SlimFast Peanut Butter Crunch Time Snack Bar, 6-Count, 4.86 Ounce Boxes (Pack of 8)
Lysol Disinfecting Wipes - Lemon &amp; Lime Blossom Scent: 80 Count
Finish Gelpacs, Fresh, 20-Count (Pack of 2)
North American Herb and Spice, Oreganol P73 Gel-Capsules, 60-Count
Resolve All-Stains Pre-Treat Laundry Stain Remover, 22 Ounce
Jarrow Formulas Magmind Nutritional Supplement, 90 Count
Nature's Way Ginger Root, 550 mg, 100  Capsules
Panasonic ER-GN30-K Nose, Ear &amp; Facial Hair Trimmer Wet/Dry with Vortex Cleaning System
Clorox Glass Wipes, Radiant Clean Scent, 32 Count
Atkins Advantage Caramel Fudge Brownie Light Meal Bar, 5 Count Bars
ProLinc Callus Eliminator, 4 Fluid Ounce
Sony Lithium 3V Batteries CR2032 10 pack
BlenderBottle&reg; Classic 20-ounce Green
Tide Stain Release Duo Pac In-Wash Booster 34 Count (Pack of 4)
Energizer A23 Battery, 12 Volt - 2 Pack
Life Extension Super Ubiquinol CoQ10 with Enhanced Mitochondrial, 100 Mg, Softgels, 60-Count
Tea Tree (Melaleuca) Essential Oil. 10 ml. 100% Pure, Undiluted, Therapeutic Grade.
Duracell Rechargeables StayCharged AA Batteries, 4-Count
Glad Freezer Zipper Quart Food Storage Bags, 224 Count
Diphenhydramine HCl 25 Mg Allergy Medicine and Antihistamine Compare to Active Ingredient of Benadryl&reg; Allergy Generic - 400 Tablets
Wahl 79524-2501 Chrome Pro 24-Piece Haircut Kit
Comfort Bath Value Size! Personal Cleansing, Ultra-Thick Disposable Washcloths, 4 packs of 8
Cleanse Detox-Promotes Colon Health with Active Acai Cleanse &amp; Detox
Optimum Nutrition BCAA 1000, 200 Capsules
Dyson Zorb Carpet Maintenance Powder, 26.5 oz.
YazyCraft 12 pcs Craft Paper Gift Bags 6&quot; * 7&quot; (1 Baker's Dozen)
Omron BP785 10 Series Upper Arm Blood Pressure Monitor, Black/white
Crest 3d White Vivid Teeth Whitening Strips 10 Count
Dixie Ultra Disposable Bowls, 20 Ounce, 208 Count
Ultimate Digestive Enzymes - Advanced Digestive Aid Support Complex - Optimizes Digestion of Fats, Carbs, Protein, Dairy &amp; More - Greatly Aids Nutrient Absorption - 90 Capsules - Lifetime 100% Satisfaction Money Back Guarantee
Zeiss Pre-Moistened Lens Cloths Wipes 400 Ct
Dropps Laundry Detergent Pacs, Fresh Scent, 20 Loads (Pack of 3)
Charmin Ultra Strong Toilet Paper 6 Mega Rolls; Pack of 3; 18 Total Mega Rolls
Omega 3-6-9 1200mg Supplement with Omega 7 Sea Buckthorn - NutriGold Omega 3-6-7-9 GOLD with ZERO Fish Oil - 180 Softgels
Nature Made Vitamelts 1500 Mcg Smooth Dissolve Tablet, Vitamin B-12, 60 Count
NuNaturals Nustevia Alcohol Free Stevia Glass Bottle Liquid, 2-Ounce
Magic Wand Massager
Homeostasis Labs Headache Relief, 50-Count
Gillette Fusion Proglide Manual Men's Razor Blade Refills 8 Count (Packaging May Vary)
TENA ACTIVE Regular , 26 Count (Pack of 2)
Nature's Way Dandelion Root Veg-capsules, 525 mg, 180-Count
NOW Foods L-Lysine 1000mg, 100 Tablets
#1 Krill Oil Omega-3 Supplement - Krill GOLD, 500mg, 120 Softgels - IKOS 5-Star Certified, Multi-Patented, GMO-free, Hexane-free, Cold-Pressed NKO Neptune Krill Oil with Astaxanthin
Strip of 5 Genuine Sony CR2032 3v Lithium 2032 Coin Batteries Freshly Packed by Sony
Omron Body Fat  Loss Monitor model HBF-306C(Black)
Finish Quantum Dishwasher, Lemon Sparkle, 25 Count
Lysol Cling Gel Toilet Bowl Cleaner, Ocean Scent, 24 Ounce (Pack of 4)
Thieves Essential Oil by Young Living Essential Oils - 15 ml
Nature's Bounty Extra Strength Hair Skin Nails, 150 Count
Durex Play Quiver Lubricant, 6 Cubes (Pack of 2)
Zarbee's Naturals Baby Cough Syrup, Grape, 2 Fl Ounce
Oral-B Professional Healthy Clean Precision 1000 Rechargeable Electric Toothbrush 1 Count
Kleenex Ultra Facial Tissue, 120 Count (Pack of 8)
Con-Cret Creatine with Micro-Dosing Unflavored 48 servings, 1.27 Ounce Tub
Clubman Pinaud Lilac Vegetal After Shave Lotion, 12 Ounce
Energizer Max Alkaline AAA Batteries, 34 Count
Crest 3D White Whitestrips Professional Effects - Teeth Whitening Kit 20 Treatments (Packaging May Vary)
Schick Hydro Silk for Women Razor
Jarrow Formulas CDP Choline 250mg, 60 Capsules
4X Comfort Flex, 120 Count
Advanta Supplements Green Tea X-tract, 500mg, 60 Capsules
KRUD KUTTER KR32 Tough Task Remover, 32-Ounce
Charmin Ultra Strong Toilet Paper 6 Mega Rolls; Pack of 3; 18 Total Mega Rolls
Remington FR-750 Pivot and Flex Men's Rechargeable Shaver with Three Flexing Foils and Intercept Trimmer, Black
Kay's Naturals Protein Cereal, Honey Almond.  1.2 oz. bags (Pack of 6)
Remington King of Shaves Alphagel Cooling Menthol Shave Gel  5 oz. (Pack of 2)
Vaseline Lip Therapy, Cocoa Butter , 0.25 Ounce, 8-Count
Vita-Mini Super Omega-3 Dietary supplement, 60 Count
Now Foods Vitamin A, 25000 IU from Fish liver oil,  250 Soft-gels
BISSELL Glide &amp; Shine Spray Mop, Black, 85E3A
New Chapter Prostate 5LX, 60 Softgels
Conair Sound Therapy Sound Machine
Woolite Dry Cleaner's Secret At Home Dry Cleaning, 6-count Box
Switch Sticks Folding Walking Stick Cane, Huntington
Philips Sonicare HX9110/02 Flexcare Platinum Rechargeable Electric Toothbrush
Band Aid Brand Friction Block Stick .34oz,  Boxes (Pack of 3)
Braun Clean &amp; Renew 2 Cartridges
Secret Clinical Strength Advanced Solid Antiperspirant &amp; Deodorant Light And Fresh Scent 1.6 Oz (Pack of 2)
Cellfood Skin Care Oxygen Gel, 2-Ounce Jars
Optimum Nutrition - 100% Whey Gold Chocolate, 5 lb powder
Cepacol Sensations Lozenges Hydra, 20 Count
Panasonic ER224S All-in-One Hair Clipper &amp; Beard Trimmer Wet/Dry with 14 Adjustable Settings
New Chapter Supercritical Antioxidants, 60 Softgels
Haan SI-35R Floor Sanitizer, Red
Vitamin D3 5000 IU, 360 Softgels - Best Value, Best Product - Premium High Potency Dose Caps Cholecalciferol - Vitamin D3 5000 Dietary Supplement for Men and Women Supports Immune System; Strong Bones and Teeth; Muscle, Breast and Colon Health; and Energy Levels - Reap the Benefits of the Sunshine Vitamin and Treat Vitamin D Deficiency Symptoms - Free eBook Bonus
Jarrow Formulas Glucose Optimizer, 120 Count
ProWash Activewear Detergent-24 Fluid Ounces-Ultimate Odor and Stain Eliminating Activewear Detergent for HE or Regular Washers (Pack of 3)
EatSmart Precision Digital Bathroom Scale w/ Extra Large Lighted Display, 400 lb. Capacity and &quot;Step-On&quot; Technology [2014 VERSION] - 10,000+ Reviews EatSmart Guaranteed Accurate
2XU Women's Performance Compression Run Sock
SENSA Chews Berry Burst
Fitbit Flex Wristband Accessory Pack, Small
MIRA Instant On Digital Bathroom Scale with lighted display
Jarrow Formulas Type 2 Collagen, 500mg, 60 Capsules
Schick Hydro 5 Blade Refill, 4-count
Suave Clinical Protection Powder Fresh 24 Hour Prosolid Anti-perspirant/Deodorant, 1.7-Ounce Boxes (Pack of 4)
Omega 3 Fish Oil Pills (180 Counts) - Triple Strength Fish Oil Supplement (1,400mg Omega 3 Fatty Acids: 600mg DHA + 800 mg EPA per Serving) - Burpless Capsules with Enteric Coating And Pharmaceutical Grade Essential Fatty Acids - Molecularly Distilled Fish Oil Supplements Including Best Health Bonus (Online Videos With Health-Supporting Exercises)
Natural Vitality Natural Magnesium Calm -- 16 oz
Nutribiotic Gse Liquid Concentrate, 2 Fluid Ounce
Omron 5 Series Upper Arm Blood Pressure Monitor
Luna Bars, Toasted Nuts 'n' Cranberry, 1.69-Ounce Bars (Pack of 15)
Philips Sonicare HX6921/02 Flexcare Plus Rechargeable Electric Toothbrush
Scrubbing Bubbles Automatic Toilet Cleaner
Playtex Sport Tampons, Unscented Super Absorbency, 18 Count (Pack of 2)
Charmin Ultra Strong, Double Rolls, 4 Count Packs (Pack of 10) 40 Total Rolls
Tide Original Scent Liquid Laundry Detergent ,  50 Fl Oz,  2 Count
Kal Pure Stevia Extract Powder -- 3.5 oz
NatureBright SunTouch Plus Light and Ion Therapy Lamp
Arctic Ease Cryotherapy Wrap 4 Inch X 60 Inch
Vitafusion Sleep Well Gummy Sleep Support, 60 Count (Pack of 2)
Lysol Disinfecting Wipes Value Pack, Lemon and Lime Blossom, 240 Count
Playtex Sport Playtex Sport Body Wipes Travel Pack, 24 Count, Pack of 5
Omron Elite 7300W Womens Avanced Blood Pressure Monitor
Clearblue Advanced Pregnancy Test With Weeks Estimator 3 Count
Herb Pharm Lemon Balm Blend Extract Mineral Supplement, 1 Ounce
Cellucor C4 Extreme Workout Supplement, Fruit Punch, 354 Gram
Jarrow Formulas Bone-up, 120 Count
Veet Gel Cream Hair Remover With Essential Oils And Velvet Rose Scent, 6.78 Ounce (Pack of 6)
Jarrow - MSM 1000 1000mg - 120 Tabs
Nayoya Acupressure Mat for Back Pain Relief
Sleep Innovations Contour Travel Pillow
Memory Loss
Servaas Lans Bar Keepers Friend Cookware Cleaner&#65292;12 oz
YouthH2O Age Defying System, Youth Berry, 15-2oz Bottles
Clif Bar Builder's Bar, Chocolate Peanut Butter, 2.4-Ounce Bars, 12 Count
Jarrow Formulas PhosphOmega, 1000mg, 30 Count
#1 Garcinia Cambogia Extract &#9733; 1600 mg (only 2 capsules/day) &#9733; Pure 100% Natural GMO Free Effective Appetite Suppressant and Weight Loss Supplement - 60 Vegetarian Capsules
Philips Sonicare HX7022/66 Eseries Standard Replacement Brush Heads, 2 Pack
RID-X Septic Tank System Treatment and Toilet Bowl Cleaner, Spring Waterfall Scent, 2 Month Supply Dual Action Blocks, 2 Count
NutriGold Pure Green Coffee Bean Extract, 90 Vegetarian Capsules
waterBOB Emergency Drinking Water Storage (100 Gallons)
Retinol Cream (Vitamin A 100,000 Iu Per Ounce) - 2 Oz
Extra Pair&reg; Value Eyes Plastic Frames 6 Pack - Incredible Value
Tempur-Pedic Sleep Mask
Dymatize Nutrition Elite Gourmet, Milk Chocolate, 5 Pound
Cotz Sensitive SPF 40 Sunscreen (3.5oz)
SENSA Month 1 Kit with Slims-On-the-Go Packets
MANGROOMER Sku 211-6 Professional Do-it-yourself Electric Back Hair Shaver
Fels Naptha Laundry Bar and Stain Remover, 5.5 Ounce
Schick Hydro 5 Blade Refill, 4-count
Jarrow Formulas Pomguard 425mg, 60 Tablets
4X Advanced Eye Health, 120 Count
NOW Foods Almond Oil, 4 Ounce
Dr. Scholl's Massaging Gel Sport Insoles, Men's Size 8-13, 1-Pair Packages (Pack of 2)
Charmin Sensitive Toilet Paper 9 Mega Rolls (Pack of 4)
Zarbee's Naturals Children's Sleep, 30 count
Bounty Huge Roll, White, 6 Count
Kimberly-Clark 55082 Model KC500 Nitrile-Xtra Powder Free Exam Gloves, Disposable, Medium, Purple (Box of 100)
St. Ives Blemish &amp; Blackhead Control Apricot Scrub, 6 oz
OXO Good Grips Upright Sweep Set
Prime Time Smile Dual Action Teeth Whitening, 0.08 Ounce
TENA Serenity Pads, Discreet Bladder Protection, Moderate Absorbency, 72 Count
Remington King of Shaves Alphagel Cooling Menthol Shave Gel  5 oz. (Pack of 2)
Energizer Max Alkaline AAA Batteries, 34 Count
#1 Omega 3 Fish Oil Capsules - Triglyceride Omega-3 Gold, 1000mg, 180 Softgels - The GOLD Standard, IFOS 5-Star Certified Fish Oil Omega-3 Supplement In Highly Absorbable Triglyceride Form
BioTech Pharmacal D3-50 (50,000 IU), 100 Capsules
OXO Good Grips Bottle Brush
Maxell Lithium 3V Batteries Size CR2025 (Pack of 5)
Pure Green Coffee Bean Extract 800mg - 50% GCA (Chlorogenic Acid) - Natural Weight Loss Supplement - Highest Quality Pure Green Coffee Bean Supplement Available!
Crest Pro-health Multi-Protection Rinse, Cool Wintergreen, 33.8 Fluid Ounce
Verilux VT10WW1 HappyLight Liberty Natural Spectrum Lamp, 5K Energy
Repel 100 Insect Repellent, 1 oz. Pump Spray, 1 Bottle
Philips Norelco 1150X/46 SensoTouch 2D Electric Razor, Frustration Free Packaging (Series 6000)
Nature's Way Activated Charcoal, 100 Capsules
Body Back Buddy TM &amp; Body Back Buddy Mini TM Self Massage Tool Duo: Trigger Point Relief
Nutrigold CoQ10 Gold (High Absorption) (Clinically-proven KanekaQ10), 100 mg, 120 softgels
Dixie Quicktakes Disposable Food Storage Containers with Attached Lids, 25 Count
Doctor's Best Glucosamine/Chondroitin/MSM, Capsules, 240-Count
#1 Krill Oil Omega-3 Supplement - Krill GOLD, 500mg, 120 Softgels - IKOS 5-Star Certified, Multi-Patented, GMO-free, Hexane-free, Cold-Pressed NKO Neptune Krill Oil with Astaxanthin
K-Y Yours + Mine Couples Lubricant, Two 1.5 fl oz Bottles
Reach Total Care Plus Whitening Mint Floss, 30 Yard (Pack of 6)
Gillette Venus Embrace Women's Razor 1 Razor 2 Refill Cartridges and 1 Showerpod
Garcinia Cambogia Extract - 100% Pure Garcinia Cambogia GOLD - 500 mg, 180 Veggie Capsules (Clinically-Proven, Multi-Patented, Water-Soluble SuperCitrimax&reg; 60% HCA Extract for Weight-Loss)
Tide Original Scent Liquid Laundry Detergent ,  50 Fl Oz,  2 Count
Kleenex Ultra Facial Tissue, 120 Count (Pack of 8)
Good Sense Ibuprofen Caplets, 200 mg, 24-Count
Proraso Shaving Soap, Eucalyptus &amp; Menthol, 5.2 oz (150 ml), New Formulation
Jarrow Formulas Methylcobalamin (Methyl B12), 5000mcg, 60 Lozenges
Bounty Paper Towels 6 Select A Size Huge Rolls (Packaging May Vary)
Tide Original Scent Liquid Laundry Detergent ,  50 Fl Oz,  2 Count
Good Sense Fiber Laxative Caplets, 90 Count
Philips Sonicare HX9110/02 Flexcare Platinum Rechargeable Electric Toothbrush
Oral-B Professional Deep Sweep Replacement Brush Head 1 Count
Nature's Way Valerian Root, 530 mg, 100 Capsules,
Leifheit 55341 Twist Mop System
Sunbeam 731-500 Heating Pad with UltraHeat Technology
Epic Dental 100% Xylitol Sweetened Mints, Peppermint, 60 Count (Pack of 5)
Colonel Conk Model 111 Santa Fe Shave Cup with Soap, (Soap scents will vary)
Omron BP785 10 Series Upper Arm Blood Pressure Monitor, Black/white
Crest 3D White Whitestrips with Advanced Seal Technology, 14 Treatments (Packaging May Vary)
Snorepin - The Smarter Solution Against Snoring and Sleep Apnea (Advanced Design Save Your Lungs)
Bounce 2 Month Outdoor Fresh Dryer Bar 1.28 Ounce (Pack of 6)
Skinny Burn - Weight Loss and Appetite Suppressant Supplement for Women - Raspberry Ketones - Green Tea - 100% All Natural Formula, Triple Strength, 30 Day Supply
Charmin Freshmates Flushable Wipes 40 Count Refills; Pack of 12; 480 total Count
Good Sense Allergy Multi-Symptom Caplets, Cool Ice, 24 Count
Jarrow Formulas Milk Thistle, 150 mg, 100 Count
Optimum Nutrition Opti-Men Multivitamins, 180-Count
Primaforce YOHIMBINE HCI 90 CAPS
Charmin Ultra Soft, Mega Rolls, 6 Count Packs (Pack of 3) 18 Total Rolls
Cerama Bryte Ceramic Cooktop Cleaner 28 Oz
PediFix FungaSoapLiquid with Tea Tree oil, 6 oz.
Ziploc Storage Bag, Quart Value Pack, Double Zipper, 50-Count(Pack of 3)
Schick Quattro For Women Trimstyle Razor &amp; Bikini Trimmer (Colors May Vary)
Braun 7000 Series Syncro Pro / Syncro Replacement Combo, Fits Braun Series 3
Strip of 5 GP High Voltage 12v A23 23AE Batteries - 12V
Body Fortress Super Advanced Whey Protein, Cookies 'N Cream, 1.95 Pounds
Jarrow Formulas Vinpocetine, 100 Capsules
Doc Johnson Sasha Grey UR3 Deep Throat Sucker
Good Sense Aller-Ease Fexofenadine Hydrochloride Tablets, 180 mg/Antihistamine, 45-count
Priva Waterproof Mealtime Protector, Blue Terry, 18 by 35 Inch
Fiber Choice Fruity Bites Nutritional-Supplements, Assorted Flavors, 90 Count
Neocell Hyaluronic Acid From Rooster Comb, 100 Mg, 60 Count
Sundown Naturals Whole Food Multi Tablet for Men, 90 Count
Secret Clinical Strength Advanced Solid Antiperspirant &amp; Deodorant Light And Fresh Scent 1.6 Oz (Pack of 2)
Rainbow Light Counter Attack, 30 Tab  (Pack of 3)
Oster 76076-010 Classic 76 Professional Hair Clipper
Finish Quantum Dishwasher Detergent with Baking Soda, 25 Count
Good Sense Nicotine Polacrilex Gum, 2mg (nicotine), Original 20-count
Powerful Emjoi Micro-Pedi Callus Remover (Latest Edition)
Derby Extra Double Edge Razor Blades, 100 Count
Jarrow Formulas 7-Keto DHEA, 100 mg, 30 Count
Braun SE7681 Silk-&eacute;pil 7 Wet and Dry Epilator, White
Conair 20-Piece Lithium Ion Haircut Kit
Vaska 48-Ounce Lavender Laundry Detergent, 3.5-Pound Bottles (Pack of 6)
Summer's Eve Cleansing Cloth Simply Sensitive, 16 Count (Pack of 3)
Afrin PureSea Medium Stream , 4-Ounce Bottles
Crane Drop Shape Ultrasonic Cool Mist Humidifier with 2.3 Gallon output per day
The Stick Massage Stick
Good Sense Acetaminophen Children's Pain Reliever Oral Suspension Liquid, Cherry Flavor, 160 mg, 4 Fluid Ounce
The HurryCane- The All-Terrain Cane
