Poise Roll-on Cooling Gel, 1.2 Fluid Ounce
Panasonic EW-BW10W Wrist Blood Pressure Monitor
Jarrow Formulas Theanine 200, 200mg, 60 Capsules
Optimum Nutrition 100% Whey Gold Standard, Double Rich Chocolate, 10 Pounds Bags, Packaging May Vary
Afrin PureSea Medium Stream , 4-Ounce Bottles
Good Sense Tussin DM, Cough and Chest Congestion, 4 Fluid Ounce
Tide Ultra with Bleach Alternative High Efficiency Original Scent Powder, 63 Loads, 114-Ounce
Jarrow Formulas Glucosamine and Chondroitin and MSM, 120 Capsules
Nature Crops Naturecrops Nutrition Bars, Quinoa &amp; Prunes, 1.4-Ounce Bars ( Box Of 12)
Very Private Intimate Moisture, 2-Ounce Bottle
Jarrow Formulas Theanine 200, 200mg, 60 Capsules
Good Sense Clearlax, Polyethylene Glycol, Osmotic Laxative 3350 Powder for Solution, 8.3 Ounce
McDavid 491 Waist Trimmer
Nature's Way Alive!: Whole Food Energizer Multivitamin Max Potency, 90 Tabs
Insect Shield (Bug Off) Synergy. Essential Oil Blend. 10 ml (1/3 oz). 100% Pure, Undiluted, Therapeutic Grade. (Blend of: Citronella, Eucalyptus, Cedarwood, Lemongrass, Lavender, Litsea, Tea Tree, Patchouli &amp; Catnip)
Proraso Shaving Soap, Eucalyptus &amp; Menthol, 5.2 oz (150 ml), New Formulation
Bounce 2 Month Outdoor Fresh Dryer Bar 1.28 Ounce (Pack of 6)
Tide Boost Vivid White + Bright He In-Wash Booster 28 Count
Remington R-5130NB Flex 360 Cord/Cordless Rechargeable Men's Rotary Shaver
SlenderFruit-7 - Weight Loss &amp; Appetite Suppression diet pills with Garcinia, Raspberry Ketones, Green Coffee, Green Tea, Acai Berry, African Mango, &amp; Lychee(60 Caps)
Doctor's Brushpicks, 275 Count (Pack of 4)
NOW Foods L-Lysine 500mg, 100 Tablets
Kirkland Signature Extra Strength Glucosamine HCI 1500mg, With MSM 1500 mg,  375-Count  Tablets
Jarrow Formulas Carbtame Diet Supplement Capsules, 60 Count
Sparkle Paper Towels, 24 Giant Rolls, Print
Conair My Aromatherapy with Oil (Colors May Vary)
Organic India Tulsi Holy Basil, 90-Count
Coromega Big Squeeze Omega 3, Lemon Nectar, 16 Ounce
Silver Tone Double Edge Blade Razor Shaver w Nonslip Metal Handle
SlimFast Snack Bites, Cinnamon Spice, 5-Count
U By Kotex Sleek Tampons Regular Absorbency,18 Count (Pack of 8)
Philips Norelco HS8420 Nivea for Men Razor
Tide Original Scent Liquid Laundry Detergent ,  50 Fl Oz,  2 Count
3M Digital Basal Thermometer
NOW Foods Liquid Vitamin D-3 5000Iu/Dropper, 2 ounce
Jarrow Formulas Jarrosil Activated Silicon Supplement, 60 Count
Duracell Coppertop AAA Alkaline Batteries, 20 Count
Verilux VT20WW1 HappyLight Liberty Natural Spectrum Lamp, 10K Energy
iPurify Colon Cleanse and Detox Dietary Natural Weight Loss Supplement,* 60 Count
Finish Quantum Dishwasher Detergent with Baking Soda, 25 Count
Eatsmart Precision Plus Digital Bathroom Scale with Ultra Wide Platform and Step-on Technology, 440-Pounds
Now Foods Mood Support With St Johns Wort Veg-capsules, 90-Count
Dymatize Nutrition Elite 12-Hour Protein Powder, Fudge Brownie, 4 Pound
Macks Pillow Soft Silicone Earplugs Value Pack, 6 Count
Plus White Bleach Whitening Gel, 5 Minute, Original Flavor, 3 oz.
Spring Valley - Biotin 5000 mcg, Super Potency, 120 Softgels
Ultra Pill Splitter By Apex Healthcare Products (2 pack)
Philips Norelco AT830 Powertouch with Aquatec Electric Razor
Nature's Way Olive Leaf 20% Oleuropein, 60 Vcaps
Nutrigold CoQ10 Gold (High Absorption) (Clinically-proven KanekaQ10), 100 mg, 120 softgels
Doctor's Best High Absorption CoQ10 (100 mg), Softgels 60-Count
SYNC Calorie Activity Tracker
Clearblue Advanced Pregnancy Test With Weeks Estimator 3 Count
Kleenex Ultra Facial Tissue, 120 Count (Pack of 8)
6 Value Pack of Zippo lighter Wicks and Flints Sealed Packs
Marpac Dohm-DS Dual Speed Sound Conditioner, Fog
Philips Sonicare HX6711/02 HealthyWhite 710 Rechargeable Electric Toothbrush
Gillette Fusion Proglide Silvertouch Power Men's Razor With Flexball Handle Technology With 1 Razor Blade
Scott Naturals Paper Towels, White, Choose-A-Size, Mega Roll (6 Rolls)
Braun Cruzer 5 Beard Trimmer 1 Count
Pure Green Coffee Bean Extract Pills, 800mg GCA&reg; (50% Chlorogenic Acid) Plus 100mg of Raspberry Ketones (Potent dosage of 900mg) - Natural Organic Ingredients - Ultra Quick Weight Loss Supplements - Lose Weight Fast With 60 Max Strength Fat Burner Diet Pills - GUARANTEED
HealthWorks Pesticide and Chemical Free Chia Seeds 2 Pounds
FreeStyle Lite Blood Glucose Monitoring System Diabetic Meter Kit
Suave 24 Hour Protection Anti-Perspirant and Deodorant Invisible Solid, Almond Verbena, 2.6 Ounce
Oral-B Professional Healthy Clean + Floss Action Precision 5000 Rechargeable Electric Toothbrush (packaging may vary)
AmazonBasics AA Alkaline Batteries (20-Pack)
Tide Boost Vivid White + Bright He In-Wash Booster 28 Count
Lightphoria 10,000LUX Energy Light Lamp
Charmin Ultra Soft Toilet Paper 6 Mega Rolls (Pack of 3)
Jarrow Formulas Curcumin Phytosome Nutritional Supplements, 500 mg, 60 Count
Jarrow Formulas Vinpocetine, 100 Capsules
Easy E-Z Intensive Weight Loss Pills. Super Energy and Appetite Control Pills. Satisfaction Guaranteed. (30 ct)
Good Sense Nighttime Cold and Flu Relief Liquid, Cherry Flavor, 12 Fluid Ounce
Ubiquinol GOLD, 100 mg, 120 Softgels - Kaneka QH Ubiquinol CoQ10
Bounce Outdoor Fresh Fabric Softener Sheets 240 Count
Shibari Intimate Lubricant Water Based 16oz Bottle.
Braun SE 5180 Silk Epil 5 Epilator with Ice Glove, Green
unspesified
Remington IPL6000USA I-Light Pro, Professional IPL Hair Removal System
Gillette Fusion Manual Men's Razor Blade Refills 4 Count
Crest Pro-health Multi-Protection Rinse, Cool Wintergreen, 33.8 Fluid Ounce
Omega 3 Fish Oil Pills (180 Counts) - Triple Strength Fish Oil Supplement (1,400mg Omega 3 Fatty Acids: 600mg DHA + 800 mg EPA per Serving) - Burpless Capsules with Enteric Coating And Pharmaceutical Grade Essential Fatty Acids - Molecularly Distilled Fish Oil Supplements Including Best Health Bonus (Online Videos With Health-Supporting Exercises)
Playtex Sport Tampons, Unscented Super Absorbency, 18 Count (Pack of 2)
Fytto Style 1007 Women's Ultra Sheer Moderate Compression Socks, 15-20mmhg, Knee High, Nude, Small Size
Ace Back Brace, One Size Adjustable
Maxell LR44 Batteries 10 Pack
Braun Cruzer 5 Hair Clipper 1 Count
OZ Naturals - THE BEST Vitamin C Serum For Your Face - Organic Vitamin C + Amino + Hyaluronic Acid Serum- Prescription Strength 20% Vitamin C with Vegan Hyaluronic Acid Leaves Your Skin Radiant &amp; More Youthful By Neutralizing Free Radicals. This Anti Aging Serum Will Finally Give You The Results You've Been Looking For - 100% Satisfaction GUARANTEED
Merkur Combo Pack of 30 Razor Blades
Fiore&reg; 6 Pack Clear Reading Glasses 3 Pair Black &amp; Tortoise (3.50)
Universal Nutrition Animal Pak Sports Nutrition Supplement, 44-Count
#1 PURE Raspberry Ketones,1000 mg Per Serving, 100% Pure All Natural Appetite Control Suppressant Supplements Diet Pills for Men and Women. Dr. Oz Recommended, Lean Organic Ingredients - Great Weight Loss Formula &amp; Benefits - Top Reviews, Lose Weight With 60 Max Double Strength Fat Burner Veg Capsules- Sold EXCLUSIVELY by Pure Body Naturals(TM)
Zarbee's Naturals Children's Nighttime Cough Syrup, Grape, 4 Fl Ounce
Dream Zone- Earth Therapeutics Sleep Mask, 1ct
75% HCA Garcinia Cambogia - 180ct - 45 Day Supply - All Natural Weight Loss Supplement
Kinesio Tex Classic 2in X 13.1 ft Beige
Vaseline Lip Therapy, Cocoa Butter , 0.25 Ounce, 8-Count
BodyMedia CORE Weight Management System
Crest Cavity Protection Toothpaste - Triple Pack 6.4 Oz
Brawny Giant Rolls White, 2 Rolls, Pack of 8 (16 Rolls) (Packaging May Vary)
4X Prenatal Multi-Vitamin, 120 Count
Secret Clinical Strength Advanced Solid Antiperspirant &amp; Deodorant Light And Fresh Scent 1.6 Oz (Pack of 2)
Tide Ultra Original Scent Powder, 80 Loads, 113-Ounce
Life Extension Super K with Advanced K2 Complex Softgels, 90-Count
Now Foods Betaine HCl, 648 mg , 120  Capsules
Nature's Way Mega-DHA, 1000mg, 60 Softgels
Jarrow Formulas Curcumin Phytosome Nutritional Supplements, 500 mg, 60 Count
Mucinex Fast-Max Adult Severe Congestion and Cough Liquid, 6 Ounce
Tweezerman No-Slip Skin Care Tool
The Art Of Shaving After Shave Balm Unscented
Arctic Ease Cryotherapy Wrap 4 Inch X 60 Inch
Panasonic EW-DS90-S Compact Battery-Powered Toothbrush, Silver
Eden Pond Queen's Magic Bee Pollen Capsules, 120 Count
Speed Stick Gear Deodorant, Fresh Force, 3 Ounce
American Biotech Labs Silver Biotics, 10 ppm Silver, 8 fl oz
Clifbar Clifbar Builders Protein Bar - 12 Pack Chocolate, One Size Chocolate, One Size - Men's
Jarrow Formulas Glucose Optimizer, 120 Count
True Blues Small Blue Ultimate Household Gloves
Viva Labs Premium Non-GMO Vitamin C with Bioflavonoids and Rose Hips, 1000mg, 250 Veg Caps
BIOSIL - 1oz. (30ml)
Omron Pain Relief Pro
thinkThin White Chocolate, Gluten Free, 21 - Ounce (Pack of 10)
Cotz Sensitive SPF 40 Sunscreen (3.5oz)
ZAQ Noor Litemist Aromatherapy Essential Oil Diffuser, White
Philips Sonicare HX7002/62 e-Series Standard Replacement Brush Heads, 2-Pack
A&amp;D Ointment, 4-Ounce (Pack of 2)
Bausch &amp; Lomb renu fresh Multi-Purpose Solution Twin Pack (2-12 Fluid Ounce Bottles)
SlimFast High Protein Creamy Chocolate Ready To Drink Shakes, 4 Count
Gillette Fusion Proglide Manual Men's Razor
Xlear Xylosweet Bag, 5-Pound
Panasonic ES-LT71-S Arc3 Men's Electric Shaver Wet/Dry with Flexible Pivoting Head and Automatic Cleaning System
RID-X Septic Tank System Treatment, 1 Month Supply Powder, 9.8 Ounce
Gaia Herbs Liquid Herbal Iron Bottle, 8.5 Ounce
Kal Pure Stevia Extract Powder -- 3.5 oz
Energizer Advanced Lithium AA Battery 4 Pack
Visine Maximum Redness Relief, 0.5-Fluid Ounces Boxes (Pack of 3)
Frankincense (Boswellia carteri) 100% Pure Therapeutic Grade Essential Oil- 10 ml
Homeostasis Labs Sleep Relief, 50-Count
Remington King of Shaves Azor 5 Blade Manual Men's Razor with 3 Cartridges
Remington Products XR1370 Hyper Series Rotary Shaver
SweatBlock Antiperspirant - Clinical Strength - As seen on Rachael Ray - Reduce sweat up to 7-days per use
Clubman Pinaud Jumbo Styptic Pencil 1 Ounce
New Chapter Every Man's One Daily Multivitamin, 24 Tablets
Jarrow Formulas Conjugated Linoleic Acid (CLA), 750mg, 90 Softgels
Philips Norelco 6945XL Electric Razor
Eden Pond Astaxanthin-Natural Powerful Bio Astaxanthin Antioxidant Supplement 4mg Capsules, 120 Count
Cold-Eeze Cold Remedy Lozenges, Honey Lemon, 18 Count
Lysol No Mess Automatic Toilet Bowl Cleaner, Citrus, 2 Count
Panasonic ER-GN30-K Nose, Ear &amp; Facial Hair Trimmer Wet/Dry with Vortex Cleaning System
Optimum Nutrition Essential Amino Energy, Fruit Fusion, 30-Count
Panasonic BQ-CASE6SA Battery Storage Cases
Gillette Venus &amp; Olay Sugarberry Scent Women's Razor
Jarrow Formulas Neptune Krill Oil, 30 Capsules
Sc Johnson Ziploc Vacuum Pump For Frozen Food
Shibari Magic Wand Massager, Ultra Powerful Double-Speed Vibrating Body Massager
New Chapter Perfect Immune Multivitamin, 96 Tablets
Cascade Platinum Actionpacs Lemon Burst Scent Dishwasher Detergent 43 Count
Cardio Defender Nitric Oxide Antioxidant Supplement, 30 Count
Kirkland Signature Non Drowsy Allerclear Loratadine Tablets, Antihistamine, 10mg, 365-Count
Cutter Backyard Bug Control 32 oz Ready-to-Spray Hose End Insect Repellent Concentrate HG-61067
Ziploc VersaGlass Container, Variety Pack, 3-Count
Philips Norelco 1290X/46 Sensotouch 3D Electric Razor, Frustration Free Packaging (Series 8000)
Kal Pure Stevia Extract Powder -- 3.5 oz
Playtex Gentle Glide Tampons, Fresh Scent Super Absorbency, 36 count (Pack of 2)
Braun Cruzer 5 Hair Clipper 1 Count
Proraso Styptic Gel, 10 ml
Air Wick Scented Oil Air Freshener, Fresh Waters, 3 Refills, 0.67 Ounce
Nature's Best Low Carb Isopure, Dutch Chocolate, 3 Lb
KRUD KUTTER CR32/6 Carpet Cleaner/Stain Remover, 32-Ounce
EO Organic Deodorant Spray, Lavender, 4 Fluid Ounce
NOW Foods - Avocado Oil (Edible) 4 Ounces
Cold-Eeze Daytime/Nighttime Quickmelt Tablets, Mixed Berry Flavor, 24 Count
Jarrow Formulas Resveratrol Synergy, 120 Tablets
Sue Johanson Super Head Honcho
Nature's Bounty Garlic, 2000mg, Odor-Free, 120 Tablets (Pack of 4)
Utopia Care Stainless Steel Straight Edge Barber Razor with 100 Derby blades
Nature's Way Valerian Root, 530 mg, 100 Capsules,
MegaSlim LIVER DETOXIFIER, Liver Cleanse, Liver Support
BlenderBottle&reg; Classic 20-ounce Green
Duracell Procell AAA 24 Pack PC2400BKD09
Fellowes 9311601 I-Spire Series Lumbar Cushion to Comfort Lower Back
Nature's Bounty, Super Potency Biotin, 5000mcg, 72-Count
OPTX 20/20 Alphareader 3 Pair Valupac Metal Readers 125
Philips Sonicare HX6013 Proresults Brush Head, Standard, 3 Pack
SENSA Month 1 Kit with Slims-On-the-Go Packets
R.E.M. Spring Facial Hair Remover
Ace Splint Wrist Brace, Reversible, One Size Adjustable
Jarrow Formulas Vinpocetine, 100 Capsules
Oral-B Pulsar 3d White Advanced Vivid Soft Toothbrush Twin Pack (Colors May Vary)
Febreze Hawaiian Aloha Room &amp; Carpet Deodorizing Powder Endorsed by BISSELL, 32 ounces
Chattanooga Polyurethane Half Size Cold Pack, 6.5 x 11-Inch, Black
Good Sense Nicotine Lozenge, Mint, 72-count, 3x24p
Philips Norelco 1150X/46 SensoTouch 2D Electric Razor, Frustration Free Packaging (Series 6000)
Prospera Electronic Pulse Massager
Mueller Jumper's Knee Strap Red
Oral-B Glide 3d White Floss Picks Radiant Mint 75 Count Package
Omron HEM-712C Automatic Blood Pressure Monitor with IntelliSense
Swiffer Sweeper Dry Sweeping Cloth Refills, 48 Count
TENA Women's Super Plus, Small/Med, 18 Count
Apex Pocket Med Pack with 7 Day Tray
Proraso Shaving Cream, Eucalyptus &amp; Menthol, 150 ml, New Formulation
Panasonic ES2113PC Pivoting Facial Trimmer
SALE! &#9733; Niacinamide Cream 5% Vitamin B3 Serum - 2 Oz - Good for Moisturizing Your Skin Naturally. Plus Acne, Spots &amp; Hyper Pigmentation Benefits &#9733; InstaNatural - Best Face Cream. Skin Lightening, Hydrates And Plumps Skin - We'll refund your money if you're not satisfied! Try Risk FREE!
Febreze Sleep Serenity Bedside Diffuser, Set &amp; Refresh, Quiet Jasmine (1 Count, 5.5 Ml)
Tide Original Scent Liquid Laundry Detergent ,  50 Fl Oz,  2 Count
Jarrow Formulas Pterostilbene, 50 Mg, 60 Vegetarian Capsules
Dove Clinical Protection Antiperspirant/Deodorant, Clear Tone Skin Renew, 1.7 oz Stick  (Pack of 2)
New Chapter Prostate 5LX, 60 Softgels
MegaRed Omega-3 Krill Oil Supplement + Multivitamin, 60 Count
SENSA Chews Berry Burst
Duracell MN1400B4 C Cell 4-Count
Sony NH-AA-B4EN Cycle Energy High Capacity AA Size 4-pc Blister Pack (2500mAh)
Jarrow Formulas Methylcobalamin (Methyl B12), 5000mcg, 60 Lozenges
Axe Peace Antiperspirant, 2.7 Ounce
Braun SE7681 Silk-&eacute;pil 7 Wet and Dry Epilator, White
Kay's Naturals Protein Cereal, Honey Almond.  1.2 oz. bags (Pack of 6)
Prestige Medical Fluoride Scissor, Purple, 5 1/2 Inch
New Chapter Every Woman's One Daily, 30 Count
Remington King of Shaves Alphagel Cooling Menthol Shave Gel  5 oz. (Pack of 2)
Sunbeam 2013-912 XpressHeat Heating Pad, Extra Large (12&quot; x 24&quot;)
Biofreeze Pain Relieving Roll On, 3-Ounce (Pack of 3)
Bengay Ultra Strength Cream, 4 Ounce
Philips Sonicare HX6711/02 HealthyWhite 710 Rechargeable Electric Toothbrush
Braun Silk Epil Pre-epilation Wipes, 16-Count
Lobe Wonder Ear Support Patches for Earrings, 60-Count Boxes (Pack of 4)
Philips Norelco BT9285/41 9100 Beard Trimmer
Tweezerman  Stainless Steel Slant Tweezer, Pink
Philips Norelco YS524/41 Click &amp; Style Shave Toolkit
Supersmile Whitening System, Original Mint,Set ,1.2 &amp; 1.4 Ounce
NOW Foods Probiotic-10 25 Billion, 50 Vcaps
CLICK Espresso Protein Drink, Mocha (14-Servings), 15.8-Ounce Canister
OxiClean Max Force Gel Stick, 6.2 Ounce (Pack of 2)
Single 20oz Sundesa Blender Bottle, Colors Vary
Philips Norelco QG3330/42 Multigroom
Source Naturals Theanine Serene with Relora, 120 Tablets
Equate - Headache Relief, Extra Strength, Acetaminophen, Aspirin and Caffeine, Coated Tablets, 200-Count
Duracell Coppertop AA 24 Alkaline Batteries (Packaging May Vary)
Philips Sonicare HX6063/64 Diamond Clean Replacement Brush Heads, Standard, 3 Pack
Trigger Point Performance The Grid Revolutionary Foam Roller
Cascade Platinum Actionpacs Lemon Burst Scent Dishwasher Detergent 43 Count
#1 Recommended Krill Oil Omega 3 - 1000 Mg Per Serving. Mega Natural Source of Omega 3 6 9, and Astaxanthin. Clinically Proven to Absorb 37.2 % More Than Fish Oil. 500 Mg Per Capsule. The Best Red Oil Supplement. Promotes Cardiovascular Health. Safe &amp; No Side Effects. *** 200 % Money Back Guarantee ***
NOW Foods Melatonin 3mg, High Quality, 180 Capsules
Panasonic ES-LV61-A  Arc5 Men's Electric Shaver Wet/Dry with Multi-Flex Pivoting Head
Colgate Optic White Whiteseal Mouthwash, Icy Fresh Mint, 8 Fluid Ounce (Pack of 6)
Nivea Lip Butter Carded Tin, Raspberry Ross Kiss, 0.59 Ounce
Eden Pond Queen's Magic Bee Pollen Capsules, 120 Count
Thermalon Dry Eye Compress
Bengay Pain Relief + Massage  3-Ounce (Pack of 2)
SmartyPants Adult Complete plus Fiber: Multivitamin, Omega 3, Vitamin D, No Added Sugar, 180 count
Sahara Extra-Absorbent Washable Underpad, White, 34x36 in., Pack/4
BIOFREEZE Pain Relieving Gel, 4-Ounce Tube
Sundown Naturals  Vitamin B12 Gummies, 500 mcg, 50 Count (Pack of 3)
Burt's Bees Baby Bee Diaper Ointment, 3 Ounce
Kay's Naturals Protein Cereal, Honey Almond.  1.2 oz. bags (Pack of 6)
Brawny Heavy Duty Wet Cloth Foil Pack, 4 Count
Philips Hf3321 goLITE BLU
Gillette Razor Power, Fusion Gamer, 1-Count Package
Braun Clean &amp; Renew 2 Cartridges
NOW Foods Vitamin D3 5000 Iu, 120-Softgels
Jarrow Formulas Coconut Oil 100% Organic, Extra Virgin, 16 Ounce
Jarrow Formulas Coconut Oil 100% Organic, Extra Virgin, 16 Ounce
Ace Reusable Cold Compress, Small
Good Sense Cetirizine HCl Tablets, 10 mg Antihistamine, 30-Count
7) Synergy Blends and 7) Top Single Oils 100% Pure Therapeutic Grade Essential Oils- 14/ 10 ml of Hope, Stress Relief, Calming, Stay Alert, Purification, Meditation, Four Thieves, Cinnamon Bark, Peppermint, Eucalyptus, Lavender, Lemon, Rosemary and Sweet Orange Aromatherapy Oil
Pure Garcinia Cambogia Extract with 75% HCA. 2000mg Daily ! Also Featuring FORSKOLIN EXTRACT as WELL ! FEATURING THE TOP TWO Appetite suppressants in ONE DIET PILL. Extremely Potent weight loss pill. Each serving has 1,000mg of garcinia cambogia extract AND 250mg of Forskolin Extract, PER SERVING !
Gillette Venus Embrace Women's Razor Blade Refills 4 Count
Air Wick Frosted Scented Candle, Apple Cinnamon Medley, 5.29 Ounce (Pack of 2) (Packaging May Vary)
Zarbee's Naturals Adult Sleep, 30 Count
Merkur &quot;Heavy Classic&quot; Double-Edged Safety Razor 34c
Move Free Ultra Omega Joint Supplement with Omega-3 Krill Oil, Hyaluronic Acid and Astaxanthin, 30 Count
Philips Norelco 8040X Moisturizing Shaving System
Degree Clinical Protection, Women Sheer Powder, Motion Sense, 1.7Ounces (Pack of 2)
Tend Skin Liquid, For Men and Women
Clif Bar Builder's Bar, Variety Pack, 9 Chocolate and 9 Chocolate Peanut Butter, 2.4-Ounce Bars, 18 Count
Nivea for Men Q10 Energy Shaving Gel, 7-Ounce Bottles (Pack of 3)
Labrada Nutrition Garcina Cambogia Extract Capsules, 90 Count
ZAQ Mini Litemist Aromatherapy Essential Oil Diffuser, White - (Battery or Micro Adapter Powered - not Included)
Gaia Herbs SleepThru, 60 Liquid Phyto-Capsules
Groom Industries Leather Protector, 16 Ounce
Set of 3 Resistance Loop Bands For Exercise (Light, Medium, Heavy) - High Quality Latex, Lifetime Guarantee
Gaia Herbs Quick Defense Liquid Phyto-Capsules, 20 Count
Nordic Naturals Omega-3 Purified Fish Oil, 1000 mg., 60 Softgels
Charmin Ultra Soft Toilet Paper (10 Packs Of 4 Double Rolls)
Agrolabs Wheatgrass Drink Shot, 6 Count
Aloe Vera Juice Organic Whole Leaf No Preservatives Lily Of The Desert 32 oz Liq
Cotz Sensitive SPF 40 Sunscreen (3.5oz)
4X Comfort Flex, 120 Count
Himalayan Institute Original Neti Pot Complete Sinus Cleansing System Starter Kit
Finish and Jet Dry Dishwasher Cleaner, 8.45 Ounce (Pack of 2)
Cold-Eeze Daytime/Nighttime Quickmelt Tablets, Mixed Berry Flavor, 24 Count
Natrol: Biotin, 10,000 mcg Maximum Strength, 100 tabs (2 pack)
Energizer 2032 Battery CR2032 Lithium 3v (1 Pack of 5)
EatSmart Precision Digital Bathroom Scale w/ Extra Large Lighted Display, 400 lb. Capacity and &quot;Step-On&quot; Technology [2014 VERSION] - 10,000+ Reviews EatSmart Guaranteed Accurate
Good Sense Nasal Moisturizing Spray 1.5 FL. OZ
Power One Size 13 Zinc Air Hearing Aid Batteries (60 batteries)
Tide Stain Release Duo Pac In-Wash Booster Twin Pack, 18-count Bag
Doctor's Best Best MSM (1500 mg) Tablets, 120-Count
Seventh Generation  Natural Laundry Detergent Powder, Mandarin and Sandalwood, 50 Ounce
Nutiva Organic Hemp Oil, 24-Ounce Bottle
Able Life Auto Assist Grab Bar
Tide Original Scent Liquid Laundry Detergent ,  50 Fl Oz,  2 Count
Dymatize Nutrition Dymatize Nutrition Iso 100 0 Carb Whey, Berry, 3 Pounds
Alka-Seltzer Original Effervescent Tablets with Aspirin, 36-count Boxes (Pack of 3)
Jarrow Formulas Bone-up, 120 Count
Gaia Herbs Liquid Herbal Iron Bottle, 8.5 Ounce
AmazonBasics AA High-Capacity Ni-MH Pre-Charged Rechargeable Batteries (4-Pack) - 500 cycles  (Typical 2500mAh, Min. 2400mAh)
Panasonic EW-DS90-S Compact Battery-Powered Toothbrush, Silver
Nexcare BWB-06 Blister Waterproof Bandages, One Size, 6 Count
Puffs Ultra Soft &amp; Strong Facial Tissues; 6 Family Boxes; 124 Tissues per Box
truMedic TENS Unit Electronic Pulse Massager, White
Trusted Nutrients 100% Pure 65% HCA Garcinia Cambogia Extract: 400 Count - 1,000mg per Capsule
#1 Krill Oil 1000mg - Double Strength Krill GOLD, 60 Softgels - IKOS 5-Star Certified, Multi-Patented, GMO-free, Hexane-free, Cold-Pressed NKO Neptune Krill Oil with Astaxanthin
Suave 24 Hour Protection Anti-Perspirant and Deodorant Invisible Solid, Almond Verbena, 2.6 Ounce
SafeTouch Nitrile Exam Gloves, Non Latex, Powder Free, Small, Box/100
EAS 100% Whey Protein, Vanilla, 2-Pound, 23 Servings
Swiffer WetJet Spray, Mop Floor Cleaner Starter Kit (Packaging May Vary)
SoothSoft Chillow
Clubman Pinaud Talc - 9 oz
Maybelline New York Baby Lips Moisturizing Lip Balm, Pink Punch, 0.15 Ounce
Jarrow Formulas L-Arginine 1000mg, 100 Tablets
Testosterone Booster Fat Burner for Men-S-500 Ultra Concentrated Muscle Builder and Weight Loss Supplement, 60 Capsules, 30 Day Cycle, Limited Edition (Fathers Day Gifts)
Benefiber SF Powder Diet Supplements, 475 Gram
Conair Moist Heating Pad
WellPatch Cooling Headache Pads, Migraine, 4 - 2 x 5 1/8-Inch Pads (Pack of 6)
SlimFast Peanut Butter Crunch Time Snack Bar, 6-Count, 4.86 Ounce Boxes (Pack of 8)
Soehnle Easy Control Bathroom Scale
Breathe Right Advanced, 10-Count
Now Foods Green Tea Extract 400 mg, 250 Gelatin Capsules
Phillips' Colon Health Probiotic Capsules, 30-Count Bottle
Swiffer Sweepervac Rechargeable Cordless Vacuum Starter Kit, 1 Kit
NorthShore Premium Green Super-Absorbent Underpads, Ultra Large Size 36 x 36, Case/60
Air Wick Frosted Scented Candle, Apple Cinnamon Medley, 5.29 Ounce (Pack of 2) (Packaging May Vary)
Now Foods Lavender Oil, 1-Ounce
5-Hour Energy Decaf (Citrus), 1.93 OZ, 12-Count
Edwin Jagger Contemporary Chrome Plated Shaving Soap Bowl
Granite Gold Daily Cleaner GG0029, 24-Ounce
Verilux VT20WW1 HappyLight Liberty Natural Spectrum Lamp, 10K Energy
KIND PLUS, Mango Macadamia + Calcium, Gluten Free Bars (Pack of 12)
NOW Foods Chlorella 1000mg, 120 Tablets
BISSELL DeepClean Lift-Off Deluxe Pet Full Sized Carpet Cleaner, 24A4
Omron Body Fat  Loss Monitor model HBF-306C(Black)
Omron electroTHERAPY Pain Relief Device PM3030
Panasonic KX-TG6592T DECT 6.0 Amplified Sound Cordless Phone with Answering System, Metallic Black, 2 Handsets
Duro-Med Deluxe Swivel Seat Cushion, Grey
Mr. Clean Extra Power Carton Magic Eraser, 4 Count
Bounty Huge Roll, White, 6 Count
Body Back Buddy TM
New Chapter Every Woman's One Daily 40+ Multivitamin, 24 Tablets
Nature Crops Naturecrops Nutrition Bars, Quinoa &amp; Prunes, 1.4-Ounce Bars ( Box Of 12)
AmazonBasics AA NiMH Precharged Rechargeable Batteries (16-Pack) 2000 mAh
Sony Lithium 3V Batteries CR2032 10 pack
Bloc Osma Alum Block, 2.65 Ounce
Dixie Ultra Disposable Plates, 8 1/2 Inch, 384 Count
Nature Made VitaMelts Vitamin C Smooth Dissolve Tablets, 60 mg, 50 Count
Biofreeze Pain Relieving Roll On, 3-Ounce (Pack of 3)
Plus White Bleach Whitening Gel, 5 Minute, Original Flavor, 3 oz.
Citracal Petites with Vitamin D3, 100-Count (Pack of 2)
Carson&reg; 5x MiniBrite LED Lighted Slide-Out Aspheric Magnifier with Protective Sleeve (PO-55)
Cardiovascular Research - Magnesium Taurate, 125 mg, 180 capsules
iPurify Colon Cleanse and Detox Dietary Natural Weight Loss Supplement,* 60 Count
thinkThin Crunch, Chocolate Dipped Mixed Nuts, Gluten Free, 1.41-Ounce Bars (Pack of 10)
Good Sense Acetaminophen Children's Pain Reliever Oral Suspension Liquid, Cherry Flavor, 160 mg, 4 Fluid Ounce
Dove gosleeveless Antiperspirant &amp; Deodorant, Fragrance Free 2.6 oz (74 g)
Dixie Plates, 24 Count, 10 1/16 Inches(Packaging May Vary)
VITAMIN C SERUM for your face is Recommended by Dr. OZ &#9733; Natural Botanical Blend &#9733; FREE eBook &quot;Staying Young&quot; &#9733; Best VITAMIN C SERUM 20% w/ Hyaluronic Acid Serum, Vitamin E, Amino Complex, Witch Hazel &#9733; ORGANIC, Professional grade &#9733; La Beaut&eacute; Pure: Simply Packaged, Simply Green, SIMPLY THE BEST &copy;
Conair for Men i-Stubble The Ultimate in Stubble Control
Clubman Pinaud Jumbo Styptic Pencil 1 Ounce
Vitafusion Men's Gummy Vitamins, 150 Count
New Chapter Prostate 5LX, 60 Softgels
Cascade Platinum Actionpacs Lemon Burst Scent Dishwasher Detergent 43 Count
Tide Original Scent Liquid Laundry Detergent ,  50 Fl Oz,  2 Count
Swiffer Sweeper Dry Sweeping Cloth Refills, 48 Count
Solgar Biotin Vegetable Capsules, 5000 mcg, 50 Count
Philips Sonicare HX8211/02 Airfloss Rechargeable Electric Flosser
Casabella Rectangular Storage Caddy, Graphite
Hyland's Restful Legs, Quick-Dissolving Tablets, 50 Tablets (Pack of 4)
Braun Cruzer 6  Body Shaver
Apex Weekly Pill Organizer, Twice-a-Day, 1 Pill Organizer (Colors May Vary)
Able Life Ez Doorknob Grips
